A1: 中资全国性四家大型银行人民币信贷收支表
A2: Sources & Uses of Credit Funds of 4 largest State-owned National-operating Commercial Banks（RMB）
A3: 单位：亿元
A4: Unit: RMB100 Million Yuan
A6: 项目 Item | B6: 2014.01 | C6: 2014.02 | D6: 2014.03 | E6: 2014.04 | F6: 2014.05 | G6: 2014.06 | H6: 2014.07 | I6: 2014.08 | J6: 2014.09 | K6: 2014.1 | L6: 2014.11 | M6: 2014.12
A8: 来源方项目 Funds Sources
A9: 一、各项存款 Total Deposits | B9: 458460.24555313401 | C9: 464544.017761564 | D9: 486633.924600653 | E9: 470394.27270824101 | F9: 473176.44073898398 | G9: 494842.01344750501 | H9: 479651.09877851699 | I9: 478582.44835815701 | J9: 486502.06643953302 | K9: 478797.911773692 | L9: 479516.69162429799 | M9: 485062.07181256003
A10: 1.单位存款 Corporate Deposits | B10: 204352.37368510201 | C10: 212831.733117141 | D10: 224779.79992793899 | E10: 219977.871035752 | F10: 222401.62878138901 | G10: 232444.92377064601 | H10: 225660.06475968301 | I10: 226133.50688468001 | J10: 227629.10366596901 | K10: 225695.87329799301 | L10: 226982.69836738601 | M10: 227733.063405252
A11: 其中：活期存款 Demand Deposits | B11: 83967.321841377401 | C11: 89336.973419267393 | D11: 94831.791976148103 | E11: 90739.430750660205 | F11: 90953.943661515194 | G11: 95974.524286987493 | H11: 92768.661272513404 | I11: 92164.088854961607 | J11: 91378.969634235502 | K11: 92004.127917491001 | L11: 93312.503942032999 | M11: 94535.523881886402
A12: 定期存款 Time Deposits | B12: 66213.8885060061 | C12: 68053.702426706106 | D12: 69622.101421944797 | E12: 69845.807398324701 | F12: 70952.6636752458 | G12: 72085.768645215096 | H12: 71239.511270591101 | I12: 72261.532017286998 | J12: 73892.205278647307 | K12: 73360.672711359497 | L12: 72469.558447351403 | M12: 73166.107759149396
A13: 通知存款 Notice Deposits | B13: 7071.7590380932998 | C13: 4935.0298939839004 | D13: 6133.1260120799998 | E13: 6528.7452469612999 | F13: 6302.3110225664004 | G13: 6525.437523654 | H13: 5682.1655654159003 | I13: 5878.9365386009003 | J13: 8235.5748235373994 | K13: 6129.0279589979 | L13: 6136.0490852424 | M13: 6273.4707984432998
A14: 保证金存款 Margin Deposits | B14: 11351.185251896401 | C14: 11621.3088742461 | D14: 12763.3061039903 | E14: 12359.4246572915 | F14: 12556.333255408499 | G14: 13358.646931368599 | H14: 12333.418064014 | I14: 12145.1196963437 | J14: 11852.941650987999 | K14: 11427.883641189101 | L14: 11275.976688852899 | M14: 11060.237857476999
A15: 2. 个人存款 Personal Deposits | B15: 246016.389744688 | C15: 243227.73465300299 | D15: 251640.53950853099 | E15: 241850.45058030801 | F15: 242241.51633309599 | G15: 251481.44476201199 | H15: 244886.29593305499 | I15: 243331.96971728301 | J15: 249324.92795131999 | K15: 243771.64594875701 | L15: 243458.080895728 | M15: 248005.83618944601
A16: 储蓄存款 Savings Deposits | B16: 234722.22918999899 | C16: 232942.22979537799 | D16: 242334.074085078 | E16: 231398.424689476 | F16: 231532.69440250899 | G16: 241073.12530812901 | H16: 233320.941246662 | I16: 233060.078951073 | J16: 239073.57025376699 | K16: 234199.17173024901 | L16: 233925.38673115199 | M16: 238552.50833553699
A17: 保证金存款 Margin Deposits | B17: 70.193006005599997 | C17: 86.173427387999993 | D17: 92.040828644100003 | E17: 89.1326522998 | F17: 86.781990535199995 | G17: 95.381867477499995 | H17: 94.554862101200001 | I17: 88.731401177199999 | J17: 79.901795380400003 | K17: 77.350914204899993 | L17: 84.494259819299998 | M17: 88.228870392399998
A18: 结构性存款 Structure Deposits | B18: 11223.9675486836 | C18: 10199.331430237 | D18: 9214.4245948091993 | E18: 10362.8932385321 | F18: 10622.0399400519 | G18: 10312.937586406 | H18: 11470.7998242913 | I18: 10183.159365032599 | J18: 10171.4559021728 | K18: 9495.1233043027005 | L18: 9448.1999047564004 | M18: 9365.0989835163
A19: 3. 临时性存款 Temporary Deposits | B19: 234.5517542634 | C19: 307.6993502441 | D19: 305.91625782530002 | E19: 281.74283361260001 | F19: 274.19236055819999 | G19: 328.53513606690001 | H19: 244.9202702739 | I19: 224.25185011670001 | J19: 256.82159290760001 | K19: 236.52058422429999 | L19: 304.81573833369998 | M19: 362.16568720459998
A20: 4. 其他存款 Other Deposits | B20: 7856.9303690806 | C20: 8176.8506411768003 | D20: 9907.6689063585 | E20: 8284.2082585677999 | F20: 8259.10326394 | G20: 10587.109778779501 | H20: 8859.8178155050991 | I20: 8892.7199060777002 | J20: 9291.2132293371997 | K20: 9093.8719427178003 | L20: 8771.0966228505004 | M20: 8961.0065306574998
A21: 二、金融债券 Financial Bond Issue | B21: 6823.3582160234 | C21: 6704.5562977657 | D21: 6705.8163533100997 | E21: 6731.9731443972996 | F21: 6484.1775832528001 | G21: 6480.0351994222001 | H21: 6157.3690055673997 | I21: 6755.7005347268996 | J21: 6763.5935422261 | K21: 6764.7983368698997 | L21: 7067.2166591955001 | M21: 6810.2787576383998
A22: 三、向中央银行借款 Borrowing from the Central Bank | B22: 2010.9882999757999 | C22: 107.65683147670001 | D22: 84.942207475000004 | E22: 105.8754897147 | F22: 122.7474780956 | G22: 135.6773487184 | H22: 133.43347459079999 | I22: 142.95567141660001 | J22: 4134.1353659396 | K22: 4133.3593145259001 | L22: 3136.8969065797 | M22: 2847.4800961401002
A23: 四、同业往来（来源方） Business with Counterpart (on source side) | B23: 24027.236838454501 | C23: 28256.629388428799 | D23: 23712.3021810055 | E23: 30753.588325512399 | F23: 31709.034379222601 | G23: 25147.319974616399 | H23: 30488.065493663598 | I23: 32126.899676100398 | J23: 27304.133217473402 | K23: 30345.4500409475 | L23: 31531.7705507848 | M23: 28432.4697670971
A24: 五、其他 Other Items | B24: 20581.286472726497 | C24: 18467.198420116096 | D24: 10071.894095914671 | E24: 19977.101046553813 | F24: 21258.84165893076 | G24: 14736.599680494284 | H24: 22067.598015020718 | I24: 24329.713347501878 | J24: =J25-J23-J22-J21-J9 -> 21637.729299287894 | K24: 25640.743369232223 | L24: =L25-L23-L22-L21-L9 -> 27135.222160583013 | M24: 30024.038596004888
A25: 资金来源总计 Total Funds Sources | B25: 511903.11538031424 | C25: 518080.05869935133 | D25: 527208.87943835824 | E25: 527962.81071441923 | F25: 532751.2418384857 | G25: 541341.64565075631 | H25: 538497.56476735952 | I25: 541937.71758790279 | J25: =J39 -> 546341.65786446002 | K25: 545682.26283526758 | L25: =L39 -> 548387.79790144099 | M25: 553176.33902944054
A26: 运用方项目 Funds Uses
A27: 一、各项贷款 Total Loans | B27: 290692.41661208402 | C27: 293499.97431494802 | D27: 297041.01198681502 | E27: 299720.000309914 | F27: 302447.89622218697 | G27: 305345.86810933898 | H27: 307449.78158726101 | I27: 309920.30486676301 | J27: 312352.46784679499 | K27: 313917.027291784 | L27: 315992.32216006698 | M27: 318188.907230101
A28: （一）境内贷款 Domestic Loans | B28: 290245.31721300498 | C28: 293054.50361949002 | D28: 296597.03692658502 | E28: 299279.15622559498 | F28: 302008.100812383 | G28: 304905.36683880002 | H28: 307013.04097003001 | I28: 309485.89234107401 | J28: 311919.82468856999 | K28: 313486.47219506698 | L28: 315564.79434040497 | M28: 317754.38600247802
A29: 1. 短期贷款 Short-term Loans | B29: 91929.515069299698 | C29: 92809.586776710203 | D29: 94285.392207738507 | E29: 94652.400304106603 | F29: 94690.537812852897 | G29: 95518.071390657293 | H29: 94568.484655644206 | I29: 94199.287280537697 | J29: 94743.782791954101 | K29: 94305.935434366897 | L29: 93904.064550107796 | M29: 94436.823968466502
A30: 2. 中长期贷款 Medium & Long-term Loans | B30: 193921.760356329 | C30: 196053.11148225801 | D30: 198305.719053899 | E30: 200481.78381932501 | F30: 202695.07363839701 | G30: 204485.01338607399 | H30: 206409.94113850099 | I30: 208215.465188887 | J30: 209956.487362518 | K30: 211205.49720147601 | L30: 212797.71960588801 | M30: 214347.23914354001
A31: 3. 融资租赁 Financial Lease
A32: 4. 票据融资 Bill Financing | B32: 4181.4249508897001 | C32: 3962.8544232354002 | D32: 3763.0346577550999 | E32: 3882.7284874186998 | F32: 4343.4952111097 | G32: 4652.0136213956002 | H32: 5743.3274520714003 | I32: 6770.6691481517 | J32: 6934.1830310846999 | K32: 7669.1501808406001 | L32: 8527.1011026236993 | M32: 8666.9558854109
A33: 5. 各项垫款 Advances | B33: 212.61683648600001 | C33: 228.950937286 | D33: 242.89100719199999 | E33: 262.24361474469998 | F33: 278.99415002310002 | G33: 250.26844067330001 | H33: 291.28772381319999 | I33: 300.47072349820002 | J33: 285.37150301380001 | K33: 305.88937838430002 | L33: 335.90908178569998 | M33: 303.36700506130001
A34: （二）境外贷款 Overseas Loans | B34: 447.0993990792 | C34: 445.4706954582 | D34: 443.97506022969998 | E34: 440.84408431930001 | F34: 439.79540980410002 | G34: 440.5012705382 | H34: 436.74061723139999 | I34: 434.41252568900001 | J34: 432.6431582244 | K34: 430.55509671610002 | L34: 427.52781966179998 | M34: 434.52122762319999
A35: 二、有价证券 Portfolio Investments | B35: 112762.840124094 | C35: 113209.65215189601 | D35: 113565.694891469 | E35: 114096.15774534699 | F35: 115378.316837928 | G35: 116426.04498862301 | H35: 118123.71658699799 | I35: 119006.12382521199 | J35: 119479.858592242 | K35: 120570.872603967 | L35: 121000.268136307 | M35: 121468.269762461
A36: 三、股权及其他投资 Shares and Other Investments | B36: 3632.2252559008002 | C36: 3245.9880490924002 | D36: 3619.5010647446002 | E36: 3413.6173496104998 | F36: 3560.3768775335998 | G36: 3857.1206767837998 | H36: 3649.3251528893002 | I36: 3416.6119181978002 | J36: 3479.3846959590001 | K36: 3169.6732055827001 | L36: 2963.9014717138002 | M36: 3657.4021383073
A37: 四、存放中央银行准备金存款 Reserves with the Central Bank | B37: 81299.570564367896 | C37: 82982.017839264998 | D37: 85939.895040301999 | E37: 83232.774851537994 | F37: 83458.520909989296 | G37: 85834.706105751393 | H37: 84004.332873114603 | I37: 84983.375869782205 | J37: 85832.937785636299 | K37: 84773.733677313896 | L37: 84941.849368636904 | M37: 84055.717680546004
A38: 五、同业往来（运用方） Business with Counterpart (on use side ) | B38: 23516.062823867502 | C38: 25142.426344149899 | D38: 27042.776455027601 | E38: 27500.2604580097 | F38: 27906.1309908478 | G38: 29877.905770259102 | H38: 25270.408567096601 | I38: 24611.301107947798 | J38: 25197.008943827699 | K38: 23250.956056620002 | L38: 23489.456764716298 | M38: 25806.042218025199
A39: 资金运用总计 Total Funds Uses | B39: 511903.11538031424 | C39: 518080.05869935133 | D39: 527208.87943835824 | E39: 527962.81071441923 | F39: 532751.2418384857 | G39: 541341.64565075631 | H39: 538497.56476735952 | I39: 541937.71758790279 | J39: =J38+J37+J36+J35+J27 -> 546341.65786446002 | K39: 545682.26283526758 | L39: =L38+L37+L36+L35+L27 -> 548387.79790144099 | M39: 553176.33902944054
A41: 注: 本表机构包括工行、建行、农行、中行。
A42: Financial institutions in this table include ICBC, CCB, ABC and BOC.